<?xml version="1.0" encoding="UTF-8"?>
<xs:schema xmlns:xs="http://www.w3.org/2001/XMLSchema">
	<xs:element name="weights">
		<xs:complexType>
			<xs:sequence>
				<xs:element name="barbell">
					<xs:complexType>
						<xs:sequence>
							<xs:element name="weightBarbell" type="xs:string" />
						</xs:sequence>
					</xs:complexType>
				</xs:element>
				<xs:element name="plates">
					<xs:complexType>
						<xs:sequence>
							<xs:element name="plate" maxOccurs="unbounded">
								<xs:complexType>
									<xs:sequence>
										<xs:element name="weight" type="xs:string" />
										<xs:element name="material" minOccurs="0" type="xs:string" />
									</xs:sequence>
								</xs:complexType>
							</xs:element>
						</xs:sequence>
					</xs:complexType>
				</xs:element>
			</xs:sequence>
		</xs:complexType>
	</xs:element>
</xs:schema>